{"$schema":"https://json-schema.org/draft/2020-12/schema","$id":"https://aese.local/schemas/plant-build-campaign.schema.json","type":"object","additionalProperties":false,"required":["schema_version","campaign","world_run_id","timezone","policy_version","m9_terminal_hash","frames"],"properties":{"schema_version":{"const":"1.0"},"campaign":{"const":"plant-build"},"world_run_id":{"type":"string"},"timezone":{"const":"Asia/Shanghai"},"policy_version":{"const":"plant-build-policy-v1"},"m9_terminal_hash":{"type":"string","pattern":"^sha256:"},"frames":{"type":"array","minItems":10,"items":{"type":"object","required":["step","phase","sim_time","capability_build_eligible"],"properties":{"step":{"type":"integer"},"phase":{"enum":["eligible","evaluating","site_selected","site_controlled","project_approved","constructing","facility_acceptance","capability_build_eligible"]},"sim_time":{"type":"string","format":"date-time"},"capability_build_eligible":{"type":"boolean"}},"additionalProperties":true}}}}
