{"schema_version":"1.0","campaign":"plant-build","world_run_id":"world-run-genesis-plant-build-001","timezone":"Asia/Shanghai","policy_version":"plant-build-policy-v1","m9_terminal_hash":"sha256:m9-incorporation-terminal","frames":[{"step":0,"phase":"eligible","sim_time":"2026-01-12T16:00:00+08:00","capability_build_eligible":false},{"step":1,"phase":"evaluating","sim_time":"2026-01-15T10:00:00+08:00","capability_build_eligible":false},{"step":2,"phase":"site_selected","sim_time":"2026-01-16T16:00:00+08:00","capability_build_eligible":false},{"step":3,"phase":"site_controlled","sim_time":"2026-05-01T09:00:00+08:00","capability_build_eligible":false},{"step":4,"phase":"project_approved","sim_time":"2026-05-02T10:00:00+08:00","capability_build_eligible":false},{"step":5,"phase":"constructing","sim_time":"2026-06-15T10:00:00+08:00","capability_build_eligible":false},{"step":6,"phase":"constructing","sim_time":"2026-06-16T09:00:00+08:00","capability_build_eligible":false},{"step":7,"phase":"constructing","sim_time":"2026-07-20T10:00:00+08:00","capability_build_eligible":false},{"step":8,"phase":"facility_acceptance","sim_time":"2026-08-20T10:00:00+08:00","capability_build_eligible":false},{"step":9,"phase":"capability_build_eligible","sim_time":"2026-08-20T16:00:00+08:00","capability_build_eligible":true}]}
